start	end	text
1719000	1736000	It's probably more interesting to read, but it can get interpreted and misinterpreted, and there are examples of that, like entire third rake was, in a sense, a misinterpretation of Ubermensch in some hot ways.
1736000	1756000	But anyways, the point I'm trying to make is that if you can build right good maxims, in a sense, like very thorough maxims, the number of people moved by it and number of people being aligned, tuned to align this correct direction, probably gets higher.
1756000	1766000	What do you think about that? Or do you think it's necessary to have the whole volume of discussion together with it?
1766000	1783000	I think it kind of leads on to at least two main themes, and I think maxim is one thing I would put a bookmark on for this discussion, because it's kind of one of those inflection points.
1783000	1795000	So let's first tackle the first fork. So we said that one of the things we are also trying to do is figure out what is worth doing.
1795000	1815000	So if I take that direction, like the worthness of something, what adds worth, but let's examine it through the question that what merits archival, like if we look at rephrasing it as what is worth archiving.
1815000	1823000	And that is a problem statement that library sciences has been dealing with since the evolution of libraries.
1823000	1837000	And this is not the same as like where this is different from what clothes do I don't throw away in the sense that at the core of archival is retrieval.
1837000	1857000	Which needs you to index things in a certain way, which means archiving indexing has existed, but information access or let's say unnecessary data or junk data, whichever way you want to put it, is something that has always existed at different scales.
1857000	1877000	The system exhibits different behavior, but if you were to follow the question that what should be archived, that question almost always seems to be a trade-off between how much can you remember or with what accuracy can you remember?
1877000	1899000	Which is where kind of how prophecies, maxims and things like this have existed. Again, prone to interpretation, even if there was a maxim and here by maxim, I mean, let's talk of like one of the things I like to bring in is physics and most of these discussions that just puts at least for me things in perspective.
1899000	1909000	The maxims are like natural laws, you don't create them, you discover them.
1909000	1925000	But which also begs the question that when is it that you can create a natural law? What kind of control would you need on that universe? The very simple layman term is God.
1925000	1949000	But again, what philosophy does is really dissect that concept, right? So if we just approach it like ignore the religious connotation part of it, but just come back to it from the perspective that if natural laws are sacrosanct in the sense that they will always exist, you just merely discover them at some point and after that they become your maxims.
1949000	1964000	So in the same way, then there has to be a journey, there has to be a process or like, well, voyages in like in order to do that discovery.
1964000	1982000	So then where does that take us from, let's say, producing enormous amounts of information today, while also being an amnesiac, increasingly amnesiac society where things are more easily lost than they are produced.
1982000	1994000	So collectively, we might be storing a lot of information at this point we're producing. Well, I don't like to use the word gigantic because they are relative.
1994000	2014000	If the internet spreads across like imagine Starfleet scale, even like the early Starfleet, James T. Kirk, just imagine the amount of data being produced. So what adjective would you then get to? So I'd like to reserve the gigantic things for when things are truly beyond comprehension.
2014000	2037000	But in any case, the case at point is that we have an acute balance to maintain when it comes to archival, that we have to let go of some things and we have to choose to remember certain things, which is what makes it easy to rewrite history by changing your interpretation to suit your current day things.
2037000	2050000	But imagine if history was a mathematically verifiable proof, which it is not today. And again, before historians throw daggers at me, I'm not saying that there is a technology solution to everything.
2050000	2077000	But if, if history was a mathematically verifiable proof for which you did not need to see the event to happen, like event happening for you to know that it's a proven thing, then we kind of reach the state where you don't necessarily need to store all of history, right?
2078000	2080000	You don't need to remember all of history.
2081000	2084000	And I'll open the field there.
2084000	2098000	Yeah, yeah, you poke me in a particular point, where if you look at the world event, I'm talking about history from a physics perspective, the interaction between bodies.
2098000	2112000	Yes, right. If you look at it, and if you can look at any frame of a certain event, not only you can predict where it is coming from, it can you can also predict where it is going.
2113000	2118000	And that's the premise of psychohistory, Harry Seldin in Foundation.
2118000	2135000	Yeah, so which kind of points towards that if you actually knew world history of at any point in time to a certain level of detail, you can predict the going forward part and going backward.
2135000	2143000	I'm talking about an ideal situation, not necessarily a humanly comprehensible model, at least humans of 2023.
2144000	2149000	But the point is, that is actually possible, in a sense, mathematically that is kind of possible.
2150000	2166000	The part where we come short here, which is again one of like quantum computing breaking cryptography, the way traditional computing said that this cryptography cannot be broken, so 256 bit is good enough for it.
2167000	2175000	And there comes quantum computing that says 256 bit doesn't matter. Yeah, I don't give a shit about this.
2175000	2180000	So point is, it breaks the assumption, ground level assumption.
2181000	2199000	If we are talking about why are these new language models and new basically the all the entire generative AI is doing so well is because the amount of memory that is we can allocate to do some certain things is humongous.
2199000	2219000	The point we can extrapolate each pixel to 1536 dimensions, which is which was not something that is the which is not something that humanly possible consciously at least apart unless you are some kind of savant on that particular thing, or it was not possible with any traditional hardware.
2219000	2224000	So things that we thought are impossible are being very possible right now.
2225000	2239000	Similarly, the exact quantified history about knowing a certain event and then being able to predict the past and the future of it, it is going to be possible very, very much possible.
2239000	2245000	It already kind of is if you think about weather prediction, how that works, it already is in effect.
2245000	2249000	We are just not using it for that particular situation or purpose.
2249000	2259000	But I don't see any reason why if we follow along the journey that we are already headed in the exponential growth of compute, I don't see why that cannot be true.
2260000	2264000	So I kind of got poked in that particular rib.
2264000	2266000	So that's why I kind of like expanded on that.
2266000	2271000	But I think you had more points to be made there in case I like cut you off.
2271000	2272000	Please go ahead.
2272000	2278000	No, no, this is this is in that direction only because see what I was trying to say is
2278000	2290000	that there are certain questions around remembrance around like public memory or let's say collective human memory.
2290000	2295000	And one of the things I have written time and again is that collective human memory spontaneous.
2295000	2302000	And it doesn't mean it is it doesn't exist.
2302000	2306000	It also means that it is that sporadic.
2306000	2311000	And that's again that's the nature of things.
2311000	2320000	If you break it down, you would eventually find a chaotic system at work with again entropy going towards like tending towards high over time.
2320000	2324000	So if you again break down everything fundamental enough.
2324000	2332000	So then if you then think of why I brought up what is where I'm trying to get my punchline together.
2332000	2336000	So what merits archival?
2336000	2345000	The decision is kind of based on what preserves the lower entropy state.
2345000	2355000	It's a constant grappling of a higher entropy entity or a higher entropy state to remember a lower entropy state.
2355000	2366000	And which is your essentially if you then look at entropy as that metaphorical river, you are going upstream, which is remembering the past gets exponentially difficult.
2366000	2371000	It's not a linear trajectory.
2371000	2373000	And that is simply if you again.
2373000	2374000	Yeah, good.
2374000	2380000	I think probably that points towards the intent of it.
2380000	2381000	Yes.
2381000	2393000	And I was just going to say that there are certain things like on the same point, certain things that are possible now, which would you would want to then look at the same questions in a different way.
2401000	2407000	Sorry.
2407000	2408000	Can you hear me?
2408000	2410000	Yes, I can hear you.
2410000	2413000	What happened?
2413000	2416000	No, it's my headset just keeps on disconnecting from time to time.
2416000	2418000	Okay.
2418000	2419000	Am I audible?
2419000	2422000	I might be a little bit low on this audio scale.
2422000	2424000	So sorry about that.
2424000	2428000	I'm just now I was trying to figure out if I'm hearing you from the external speaker on headphones.
2428000	2429000	Yes.
2429000	2437000	So no matter how much you improve technologies, certain things never change like this.
2437000	2442000	There are different, different variants and you can keep on going throughout the ages.
2442000	2445000	Oh, I did not see your fire sign across the hill last night.
2445000	2446000	I'm so sorry.
2446000	2451000	Can you see my fire sign?
2451000	2453000	I mean, just the point.
2453000	2454000	Yeah.
2454000	2455000	Sorry.
2455000	2456000	Yeah.
2456000	2457000	Little detour.
2457000	2460000	You remember the penguins of Madagascar that movie where?
2460000	2461000	Yeah, yeah.
2461000	2465000	Dave and he is trying to.
2465000	2466000	Dave?
2466000	2467000	Yeah.
2467000	2469000	Dave.
2469000	2471000	Anyways, anyways.
2471000	2472000	Same thing like that.
2472000	2481000	That seemed that hit kind of like in a particular court for everybody who ever has been into meetings of this kind.
2481000	2496000	And you saw somebody where this hoodie encoded last day, which wrote you were on mute.
2496000	2497000	Okay.
2497000	2500000	Popular culture catching up.
2500000	2512000	So anyway, that is one of the afterburner effects of how probably the two of us here look at what is worth doing.
2512000	2521000	Turns out to be a very misanthropic concept at its outset, but probably, well, not as much misanthropic.
2521000	2528000	It's selectively anthropic, let's call it.
2528000	2531000	Yeah, I have a question there on that.
2531000	2534000	What is anthropic?
2534000	2535000	Hmm.
2535000	2539000	I try to dissect Latin a bit.
2539000	2543000	And my knowledge of, again, the misanthropy is vague at this point.
2543000	2545000	I'd rather not comment at this thing.
2545000	2557000	Let's just look at it as the.
2557000	2569000	What is it when the compatibility that it's a misanthropy is a non compatible component in a society of humans.
2569000	2570000	Oh, no.
2570000	2571000	Somebody.
2571000	2574000	So you're already assuming you're already assuming.
2574000	2575000	Yeah.
2575000	2576000	Anthropic system beforehand.
2576000	2577000	And you're trying to.
2577000	2578000	Yes.
2578000	2579000	No, that was.
2579000	2580000	Yeah.
2580000	2581000	My question was.
2581000	2582000	I was just trying to show the loop.
2582000	2583000	Okay.
2583000	2584000	But yeah.
2584000	2597000	So the question, if you try and understanding what is humanity, what is anthropic, the more you try to see, look into that, the more it turns out to be.
2597000	2614000	What ever, what are the traits we term as humanitarian are exactly the opposite of what actually pushed us to become the humans, the dominant species.
2614000	2622000	That the last straw of that is human versus Neanderthals.
2623000	2624000	The last straw.
2624000	2642000	The last provable bit is that Neanderthals, they weren't like they had the exact and like similar kind of social bonding, the empathy and like caring for others.
2642000	2649000	All the other all the traits that we say these are the good like working with as teams, etc, etc.
2649000	2654000	All those things that we talk about as these are the good traits to have.
2654000	2656000	And if you say that that's what made us humans.
2656000	2658000	No, they also had that.
2658000	2668000	What did they not have is that Machiavellianism for a lack of a better umbrella term.
2668000	2678000	But you mean the prince, like not having an organized direction to channel the collective energy.
2679000	2690000	In a sense that basically attacking the enemy at night, knowing that they already don't want to fight at night.
2690000	2701000	It is not moral or it is not acceptable, ethical to fight at night and knowing that using that as an information to fight at night.
2701000	2705000	What did you call that?
2705000	2713000	So that those are the kind of things that made humans humans.
2713000	2718000	Like I'm probably just showing the tip of the iceberg.
2718000	2729000	You can keep on going down that rabbit hole and keep on trying to find out more and more personality or psychological traits that are absolutely heinous.
2729000	2732000	And that still lingers on, by the way.
2733000	2741000	But those are the ones kind of gave us the edge over the other ones who had not much differently.
2741000	2754000	Even if you go down from hominid to the pan, basically the chimpanzees and gorillas, they also have the social structure in the same way.
2754000	2759000	They also show that their child dies. They show the same kind of sympathy.
2759000	2765000	But what about anthropic humanity that makes us human?
2765000	2769000	If you keep asking that question, it kind of gives us a very dark answer.
2769000	2783000	Exactly the things that we grow up learning as the traits to have as humans are not the ones that made us if we actually stuck to only those ones.
2783000	2791000	I'm not saying that those are not important, but I'm saying that only pure silicon does not create a good microchip.
2791000	2801000	You need the doping in order to create that semiconductor that actually can be turned on or off.
2801000	2810000	That doping, that dopant part is the one that is not really the light part is the dark part.
2810000	2816000	So the moment you talk about that, a kind of like it might sound misanthropic.
2816000	2824000	Most of the utilitarian or things that generate result drive result are misanthropic.
2825000	2843000	If you psychoanalyze most of the CEOs of Fortune 500, you're not going to find the answers that you would like that these are the best human beings that driving the society or culture or at least from a textbook perspective.
2843000	2851000	You have studied this. You can talk more about that part. What do you think from that perspective?
2851000	2858000	I think that's an eventuality of any species that does not have a self sufficient energy system.
2858000	2873000	And because as you as you break that question down and you're going to first encounter the stage of ethics very soon,
2873000	2884000	because this is fundamentally an ethical question with a political philosophy very strongly ingrained in it.
2884000	2897000	Because a lot of these thought systems have also evolved in order to just look back and identify what the hell had happened there.
2897000	2906000	And in the process, like what what was it that happened and then building those systems to come up to a point that we could explain all of this.
2906000	2915000	And then, you know, as happens with intelligent brains that once you are looking at it for too long, you start seeing variations in it.
2915000	2919000	And well, that is how pretty much all branches of philosophy evolve.
2919000	2930000	You cannot have a well informed argument in philosophy if you have not looked at that thing long enough for you to see the details in it.
2930000	2942000	So for from that perspective, when you start breaking down the concept of humanity at the core of it would be the conquest for resources to survive.
2943000	2952000	One survive, then thrive, one thrive, then conquer, one conquer, then build, one build, then colonize and so on and so on.
2952000	2956000	Or maybe even in the in some loops thereafter.
2956000	2974000	But then the thing then what we cannot change here, unless we are a self reliant, like we have a self-sufficient energy system.
2974000	2985000	When I say energy system, just imagine the combination of an unlimited uterium supply and unlimited replicators in the Star Trek context.
2985000	2993000	If you have those two technologies or those two resources available in vast quantities that can change any society in any direction.
2993000	2999000	At that point, direction is a matter of the forces immediately pushing it till the resources expire.
2999000	3006000	Now imagine in a universe where you cannot destroy replicators and dilithium resources.
3006000	3011000	Just imagine a game world like they are non-destructible resources.
3011000	3013000	You can go bang against them, nothing will happen.
3013000	3025000	So eventually the entities in that world will learn to live with the fact that they can build anything at any point and with unlimited energy.
3025000	3028000	And suddenly the craze for resources do not exist anymore.
3028000	3034000	And we have reached that platonic ideal state of sorts where you don't need to have that lust for hunger.
3034000	3039000	And you can then focus on something that is a higher principle.
3040000	3049000	The disconnect between all, let's say the key drivers of human driven change, let's say.
3049000	3057000	And I mean the people ultimately responsible for whatever actions humans are performing at mass scales.
3057000	3066000	Those people usually portray this imagery that they are already at that stage where they have a self-reliant system
3066000	3070000	and that they are just doing everything for the greater good.
3070000	3074000	All I'm saying is that is necessary. It will eventually be part of the system.
3074000	3087000	But for now, the thing that we need to remember is that we are operating under limited resource in a world where we are not energy self-sufficient.
3087000	3092000	That is, we need to extract energy from other places.
3092000	3102000	With that in context, then the question of ethics shifts from is doing that good or bad to how can you do that better?
3102000	3110000	That we are today extracting a massive amount of meat from animals.
3110000	3116000	So you can use the same tool now to dissect any concept and go into that debate.
3116000	3130000	But what I'm trying to say is I think the question that is that good or bad, like is progress good or bad, eventually is a polarizing question.
3130000	3146000	And it's polarizing because, well, too much progress and not enough progress have only one meaning at the scale of the universe.
3146000	3153000	And that is maximum entropy saturation and no entropy at the beginning of the universe.
3154000	3162000	Between that, between if you need to, I mean, if let's say we for the sake of the discussion that we must make it bipolar,
3162000	3172000	let's make sure the poles are that far apart and be humble in approaching what we are approaching in that space.
3172000	3182000	So then anthropomorphic or anthropogenic concepts become, that is what I was trying to say, they become a limiter.
3182000	3190000	And you can again go into the argument for good or bad reasons, in which case see the last 10 minutes of this talk.
3190000	3199000	But what I'm trying to say is that we can instead look at the fact that there are certain things we cannot avoid.
3199000	3208000	Like I cannot keep my cat from having a good time outside just because another cat outside is terrorizing this cat.
3208000	3214000	If I keep the cat indoors, I will keep it the safest, no doubt.
3214000	3226000	And if you want to make that into a question of morality, then is that the right use of those few CPU cycles?
3226000	3228000	That is a question of morality.
3228000	3237000	Yeah, I know. So I get where you're coming from. I kind of have follow ups. Sorry, I might be too not loud, essentially.
3237000	3241000	What is opposite of loud? Anyways, I can hear you clear.
3241000	3253000	So the world of abundance, energy self-sufficiency, I'm not using that term because I'm just using a more generic way that makes sense to me.
3253000	3262000	So just to be clear here, when I said energy self-sufficiency, I meant in the true sense of us having a cyclical energy economy.
3262000	3271000	You're technically correct, but I'm saying world of abundance because before we reach that energy self-sufficiency,
3271000	3281000	the reason it's tail chasing perpetual is because you can keep on going.
3281000	3291000	The more amount of energy you chase, the more amount of energy you need to chase that, it kind of gets to a point like how many Kardashev skills do you want to go?
3291000	3295000	So that's the reason I'm not using that. I'm just using a more generic term.
3295000	3302000	Let me just interject here once. What I was trying to really make the point is that these are important questions, but these are not urgent ones.
3302000	3309000	These are questions that we need to consider when we are at that stage without which we will constantly be in this phase.
3309000	3316000	And there are more immediate concerns and there are more immediate possibilities that we would get to.
3316000	3323000	And just to sum that up, one of the areas that I was talking of or trying to get to is that when we are looking at morality,
3323000	3328000	or let's say, should I do some like that archival context, right?
3328000	3339000	One of the things that we can do with a lot of the systems that we have right now is again following Floridi's description that we run more simulations.
3339000	3345000	That one of the things if you, so this is where I want to tie that to the maxim, but that I am not against maxims.
3345000	3351000	I understand the value of maxims. I am terribly skeptical of when maxims are set in stone.
3351000	3361000	I am very much fond of maxims that are the output of an elaborate computation which gives me a certain predicted result.
3361000	3370000	And similarly, if the input conditions change, the output might change, but the output will still be provable based on the input conditions that I have received.
3370000	3377000	So if those are the maxims, the issue we have with the maxims of till date technology is that maxims had to be written in stone
3377000	3387000	because they had to convey the largest possible information and they were open to understand, open to interpretations.
3387000	3395000	Now, what if you don't just save the maxim? You save the version control history, for example, that led to the creation of the maxim
3395000	3402000	so that lawyers of future date, when they use this maxim as a founding principle, they can also analyze the maxim if they need to.
3402000	3412000	And that's just one aspect that what we have gained is the ability to simulate a lot of this, store a lot of the state to make it replayable,
3412000	3420000	which brings back to that verifiable history as an archival thing.
3421000	3440000	I agree on that part. The part that I am seeing that more can be added here is that when you are saying that, OK, which part do we need to decide to keep?
3440000	3447000	I'm seeing the pattern that we actually don't need to because we don't know which part actually we end up being important.
3447000	3460000	Yeah, but what we can do, so then we don't need to, it does not mean that the system is that black ship of in the restaurant at the end of the universe.
3460000	3468000	The restaurant at the end of the universe, where it is just one voice command control and I'm not talking of that.
3468000	3478000	I'm talking of intervention under the right layers, which is kind of let the mass scale system, the mass data processor do its work
3478000	3488000	because it's already been trained or you can let's say tweak the parameters, whatever, but let it do its work, step back, but have the capability of chiming in.
3488000	3502000	For example, keywords, for example, just the ability to indicate that, OK, go back and switch from here, but which are all in essence better retrieval.
3502000	3514000	Yeah, so think about it in this way. The way mummies are kept, they were not creating that as a time capsule so that the latter point in time people can dig them up
3514000	3522000	and learn more about their history, which kind of oils were being used, what is the isotope and all. They didn't know that they didn't have to find that out.
3522000	3532000	They didn't know that, OK, the fingerprints that they leave are going to be uniquely identified that how many people actually worked on this particular month, those kind of things.
3532000	3543000	I have a very interesting what I had once written on this. Let me just see if it fits here that one of the answers to what is worth archiving.
