start	end	text
5259000	5263000	So I think it is better to keep those things out for the future.
5263000	5278000	Couple of things, couple of topics that like one part is that the nihilism, like what kind of energy we are talking about here, establishing those things, going around that part.
5279000	5283000	So I can just add one point here.
5283000	5294000	The idea of the philosophical analysis of some of these seemingly political principles is that they make for very good taste suits for any system that you build,
5294000	5303000	which means I am now talking of that we need to build software systems where our software testers are philosophers
5303000	5308000	so that they can actually know what is the right thing to test the system against.
5308000	5310000	What are my automated tests supposed to guarantee?
5310000	5316000	And I want to approach these from the testability of a software perspective as well.
5316000	5320000	In fact, I would argue that's probably where the world is headed.
5320000	5322000	It's not that that's that should happen.
5322000	5330000	It probably would become very like I think it will just become purely out of several of the fittest in a couple of.
5330000	5331000	I don't really know.
5331000	5333000	I'm very bad at breaking the years.
5333000	5341000	But in two years time, I'm I'm fairly certain that people who have better understanding of epistemic,
5341000	5350000	how to understand the framework itself more than the execution of like basically story point driven output,
5350000	5359000	they're going to start winning out a massive amount to the point that it will become obvious to everybody else that that aspect is way more important.
5359000	5366000	Actual execution of getting the things done can pretty much be delegated to a declarative statement
5366000	5372000	and then waiting for the model to execute that and come back to you.
5372000	5380000	Deciding what is how to tackle that problem, what the declarative statement is, what is worth doing,
5380000	5387000	that part, understanding of epistemic of that part, building the test system where that can be validated or not validated.
5387000	5390000	Those are the parts that are going to start mattering way, way more.
5390000	5401000	And yeah, one of the things that I have seen and I also want to discuss about that is that how was the utilitarian and deontological standpoint
5401000	5406000	and how does that relate to I don't know whether there's an actual background to that,
5406000	5414000	but how does that relate to a declarative versus procedural, not procedural, imperative essentially.
5414000	5420000	I completely forgot. At one point I had told you there are two forks and I went down one fork and I continued.
5420000	5428000	The other fork was supposed to be this declarative versus this discussion as basically the flow-based programming
5428000	5434000	or that's where it came to entity component system as other software paradigms,
5434000	5445000	which if you look at J.J. Palem's papers on flow-based programming between the 60s,
5445000	5453000	they read like science fiction because the computing systems of the days could not even control what were happening.
5453000	5461000	But then if you look at it, that's a system which lets you have logic interposed at places where data is being transformed,
5461000	5465000	which again means that you are then designing a system.
5465000	5472000	So again, if you go to episteme, I found it extremely straightforward when I first read flow-based programming.
5472000	5478000	I got so excited I showed it to three colleagues and they found it absolutely archaic and useless.
5478000	5483000	Then I showed it to a few others and some of them again had this instant click.
5484000	5488000	And that is when I went back to the question that what is the difference here
5488000	5492000	and the difference turned out to be the knowledge of how knowledge forms.
5492000	5496000	So we are talking about the same thing, we are coming to the same conclusion,
5496000	5500000	but we kind of came to the exact same understanding from two different angles.
5500000	5504000	Yes, and that's the whole point to show that that's the intersection.
5504000	5510000	That would be actually, I think that actually requires way more reflection.
5510000	5512000	I don't think we should go into that one.
5512000	5514000	This is just a summary.
5514000	5518000	But this is one of the topics that we should probably cover.
5518000	5521000	The immediate next one probably, we should probably go into this one.
5521000	5523000	Yeah, I think so.
5523000	5525000	This is going to be interesting.
5525000	5531000	And if you want to scope it down, then we can compare the architectural analysis,
5531000	5534000	like I said, of the ECS on those principles.
5534000	5538000	There are some of the things that I have some thoughts that I would like to bounce for.
5538000	5544000	But the other place where I have reasonably thought through for a while is the software testing angle.
5544000	5550000	So I actually want to tackle the question that what does it mean for software testers
5550000	5556000	with the current kind of systems that are coming in,
5556000	5563000	which again, just if you might want to note, the part I want to focus on is the definition of testers.
5563000	5565000	That was the question I was going to ask.
5565000	5567000	Does it have to be software tester?
5567000	5572000	It pretty much seems like any kind of system evaluator would want to.
5572000	5573000	Yes.
5573000	5577000	So the software testing was just to intentionally scope it down.
5577000	5580000	But eventually the question was testability.
5580000	5584000	The ability to test a system being a more important skill
5584000	5589000	than the ability to either build or operate that system.
5590000	5596000	In fact, the second part is basically an extension of being able to,
5596000	5603000	like having the intent, which basically being able to do the declarative,
5603000	5610000	whichever method mechanism you use, being able to declaratively convey the intent
5610000	5614000	and then testing out whether that intent was carried out or not.
5614000	5618000	Those two are the only things basically that is at the crux of everything,
5618000	5620000	like any kind of compute mechanism.
5620000	5625000	And everything else comes down to the, what is the right term for it?
5625000	5628000	Basically to serve these two things.
5628000	5633000	Yes. And we should ensure, we must ensure that interfaces
5633000	5640000	and every other ways of interaction with technologies here on keep these principles in mind.
5640000	5643000	And again, I'm talking beyond software.
5644000	5647000	Yeah. In fact, I want that to be beyond software
5647000	5653000	because it's absolutely fine to use software as the proving ground where we...
5653000	5655000	Simulations.
5655000	5658000	Yeah. But then it needs to transcend that part.
5658000	5663000	And I'm pretty sure I'm more than certain that it actually has a bigger ground to play
5663000	5667000	if we can actually turn it into a model that is cohesive enough.
5667000	5669000	Cool. Fantastic.
5669000	5674000	So I am not available next week and probably the week after.
5674000	5678000	I'm traveling, so we have a work meetup.
5678000	5684000	So I'll come back and let's catch up then. I'll keep you posted.
5684000	5687000	Sure.
5687000	5692000	That was the most depressed you are ever.
5692000	5694000	Yeah.
5694000	5696000	That's fine. That's fine.
5696000	5702000	I probably can try to, but I don't think that would be fair to do.
5702000	5707000	It's not fair to do also because now I have a different time availability factor.
5707000	5711000	So I was like, why don't you do it twice a week?
5711000	5716000	I think that is absolutely a possibility. But once I come back.
5716000	5719000	This is one of the things that I plan.
5719000	5724000	So since 2018, I haven't actually taken a break with my family.
5724000	5728000	My first break since 2018. Oh my God, I got to go rest.
5728000	5731000	Yeah. So basically I haven't really taken a break with my family.
5731000	5734000	And it was not possible because the kid was too small.
5734000	5740000	Now she is just about old enough to know the address and the parent's name
5740000	5742000	in case she kind of goes missing.
5742000	5745000	I kind of think in terms of worst case scenarios.
5745000	5747000	So that's probably the best way to put it.
5747000	5751000	But the point is now it's time we can actually go somewhere.
5751000	5753000	So basically this was a long time coming.
5753000	5755000	So I don't want to take something away from them.
5755000	5757000	So this two weeks is going to be a bit hectic.
5757000	5762000	But after that, when I come back, I'm more than open to like explore this
5762000	5766000	with intensity essentially. Right. Let's go.
5766000	5768000	All right. Thanks a lot.
5768000	5771000	I'm going to end the stream for anybody watching the stream.
5771000	5773000	And then.
