start	end	text
3543000	3553000	I mean, I had asked you a question I had, of course, thought through a bit is that a very different thing that I want to live in a situation like let's imagine a hypothetical society
3553000	3573000	where as we live our daily lives, libraries form, as generations pass, museums form, as more people want to play parks form and as more people just want to stay quiet, things don't change.
3573000	3586000	Yeah, and so that is kind of. Yeah, that's profound. That is one of the maxims in a way. If you can just pack it together in a good package, that is the maximum.
3586000	3592000	I understand that you don't have to explain, right? No, I'm just explaining for the sake of the technicality.
3593000	3606000	This is what I mean when I say that the answer to what should be archived should not be a specific answer, which is if you're writing software, do not give me specific if then else, please use functional programming.
3606000	3615000	Please think of data transformations, data flowing through a system and write functions to transform at those intersections rather than dealing with discrete data.
3615000	3629000	And similarly, when we're talking philosophy, we very quickly go from a more abstract concept to a discrete concept and still think it is abstract, which is where the fallacy is creeping.
3629000	3640000	Those are the places where I get concerned if I am not caught, like that's when I would expect somebody like you to hold my feet to the fire, essentially.
3640000	3645000	If I ever fall to those, I don't don't try to jump around the as in dance around the topic.
3645000	3649000	If ever I am making any kind of like a fallacy.
3649000	3658000	The only time I dance around the topic is if there is a force field around it that I can't get through to it.
3658000	3667000	Or let's say even better, a bonfire in the center of it, a force field around it, and I am really in a good mood to run around the fire.
3667000	3669000	Maybe there's also a good music.
3669000	3673000	Yes, in which case, maybe that's the topic. But let's say it's like some sort of it.
3673000	3681000	Yeah, so the what I was trying to say, I forgot. Okay, so the intent part of it, so some part of it.
3681000	3686000	So the reason when I asked, right, I also kind of thought about that part.
3687000	3708000	When I say that what is worth doing after deciding what is good to do, the intent eventually pushes itself in like nature, pretty much in all of this discussion is in like deciding who is who is deciding what to do.
3708000	3722000	There will basically forming the next part of the fabric, essentially the pattern in the fabric of reality, if they choose to go forward and pursue that essentially.
3722000	3740000	So at the center of it, there is nobody telling you that you need to do this. It's you deciding to tell yourself that I need to do this.
3740000	3747000	Unless your managers put it on the sprint roadmap without consulting you.
3747000	3756000	I mean, I get the joke, but my counter joke, which will not sound as a joke is that you have to be able to drop the manager.
3756000	3762000	Before you drop the manager, can you assume to be the manager?
3762000	3772000	No, no. If you kill the god, you now have the responsibility to be the god. I'm coming from that perspective, but I know that.
3772000	3788000	Fair, fair, fair. Again, what we were just about to take what two different moralistic stances and based on the initial variable, like that very input into that function, the output would have been different.
3788000	3798000	And these are the places where I said that when your discussion comes full circle and you see a fork in the road back again, but it looks like one lane you have already come through.
3798000	3807000	That's when it's time to mark that put a direction that this was already covered. Now we go here so that you can go in that direction.
3807000	3811000	And how do we mark this one?
3811000	3818000	Well, let's market with.
3818000	3826000	I don't know. I'm very curious to see what the system does. I don't want to give too many inputs at this point.
3826000	3835000	I just want to see what comes out because it's like, you know, you've bought a stock car before you write it and understand don't tune it.
3835000	3840000	Because you won't know what exactly changed as a result of the tuning. So like this is my first time.
3840000	3846000	So recently I come like I came across that would be the right time.
3846000	3852000	So a particular situation where this is this made a whole lot more sense.
3852000	3870000	So the GRR Tolkien's interpretation of where he was coming at, like the moralistic, his moral standpoint, why he was against Sauron or technological development, in a sense, which Sauron embodied.
3870000	3878000	The issue with any Tolkien modalities, it can be dethroned in one shot, but yeah, take it in the context of what you're saying.
3878000	3892000	But yeah, so what Sauron represented is that knowing that Eru Il-Hutur exists, he kind of like, no, I am going to replace you with myself in a sense.
3892000	3905000	Like I'm talking about the new I have I don't know whether you have watched it, the Prime series, the Rings of Power.
3905000	3907000	I don't think you have watched.
3907000	3914000	I don't know if I have not. If I started then I started then it had some place where yeah.
3914000	3924000	Yeah, you probably wouldn't like it as somebody who has invested interest into the cohesiveness of the world that you have already known.
3924000	3934000	And though from the light from the perspective from which light you have seen it, it would seem like a kind of desecration in a sense.
3934000	3938000	Like somebody is one screaming before you continue.
3938000	3955000	One thing to note about how I potentially look at a lot of the rings is it's an revisionist history of a massive, massive peasant uprising that kingdoms were forced to unite and bring down.
3955000	3959000	And when you put that lens, then everything else makes that much more sense.
3959000	3965000	Then why Aragon is being this douchebag Aragon makes more sense.
3965000	3974000	And why why like repair this one blade over the cost of this fucking get a new one made man might even get you better technology nowadays.
3974000	3979000	But no, the emblem was more important than the weapon itself.
3980000	3982000	Where things that just make it.
3982000	3987000	I'm just saying that, of course, I have read it and I understand it as Tolkien intended.
3987000	4004000	But I also see it as a potentially in looking at our current times that it kind of fits almost as if it's a revisionist history that there was some other history which we if we dig deeper in some lost scrolls like the charwaks will find something else existed.
4004000	4011000	When you when you say that it's a revisionist history, it tells me everything that I need to know about your standpoint on that.
4011000	4019000	I don't need more explanation than this, honestly, because I don't know what is relevant for archival.
4019000	4023000	No, so I'm also marking my own bookmarks for future retrieval.
4023000	4032000	Right. So knowing that the way I've seen most of the Tolkien fans discuss this or come come at it from no, no, no.
4032000	4036000	You are basically this is sacri, what do you call it?
4036000	4049000	Sacrimonious for the most people they think the most feminist moment in Lord of the Rings was you opening her helmet and saying I'm not a man.
4049000	4053000	Yay for feminism. That's like their the peak of their understanding.
4053000	4057000	So yeah, so so that's sanctimonious position.
4057000	4059000	If you hold it, then it would hurt you.
4059000	4066000	But if you can open your mind like, OK, this is a world that can have multiple different interpretation in different people's eyes.
4066000	4070000	How can you say this in this world?
4070000	4077000	Galadriel is not so much so different than the enemy that she is trying to kill.
4077000	4079000	And it is very clearly shown.
4079000	4088000	Yeah, and eventually she discovers that she is pretty much word for word the same entity.
4088000	4092000	And if she does win, like you can take sides, you can pick sides.
4092000	4105000	But if and the person that Sauron is trying to like rage against, like fight against or like replace cannot like basically in the story's frame, you cannot.
4105000	4112000	The person who created the universe, but trying to the directionality is on the same way.
4112000	4118000	Like I will enforce my will onto this world. Innocence.
4118000	4125000	End of the day, when I replace you, I will rewrite the history the way I see it fit.
4125000	4129000	And people will know you were the bad guy. I am the good guy.
4129000	4136000	So whatever is shy clue in the before is the Satan after essentially innocence.
4136000	4146000	So if you see it, see that from that perspective, you also see that Galadriel is effectively the same person, not so much different from Sauron.
4146000	4151000	And if she ends up winning, she will not do something that's different than her.
4151000	4159000	She's likely to dismantle the patriarchal power structures that exist in the world.
4159000	4167000	If that is what you want, that is your intent to preserve that history.
4167000	4175000	And you are more into no, I am more into I am into this patriarchal structure or I don't care about that.
4175000	4180000	I just care about their technology and how much they are building, et cetera, et cetera.
4180000	4186000	And you choose to be on the side of Sauron. That is also an option. You can do that.
4186000	4194000	And end of the day, whoever ends up winning will end up writing that history turns out in this particular story, Sauron ends up losing.
4194000	4203000	So his people are uglier and shorter and speak a language that the book is not written in innocence.
4203000	4208000	It's a dark language. He ends up winning.
4208000	4213000	That is the language of the book. And the other language is the dark language.
4213000	4220000	The point I was trying to make is that all those discussion about morality, it kind of comes down to that.
4220000	4235000	What is the person who is observing the person who is narrating and the person who is intending to preserve the part of the history, which side they want to take effectively comes down boils down to that.
4235000	4240000	So at the end of the day, you kind of have to take that.
4240000	4248000	I want to preserve this part of the history. I want to make this part this kind of changes, this change in entropy.
4248000	4253000	Oh, I have another example on this. So entropy and hold on to that.
4253000	4263000	And if you can end up executing it, now the world has that scratch mark, that entropy imprinted on its reality.
4263000	4269000	Think about how do you create a stone statue?
4269000	4273000	Think about the entropy of a stone statue.
4273000	4280000	We say that entropy is something that is basically disintegrating and taking a low energy state.
4280000	4288000	No, but that is the misconception of understanding of entropy. Entropy is not disintegrating.
4288000	4301000	How would you define because for a statue, somehow some sense had to come together or you're muted.
4301000	4303000	You are muted.
4303000	4305000	I am not on mute anymore, but there is a lag.
4305000	4308000	OK, sorry, go ahead.
4308000	4315000	Yeah, so I was saying just pointing out the fact that it's not entropy that is decreasing.
4315000	4323000	It's the action like the entropy as the agent of change, because entropy is growing in that sense.
4323000	4328000	So just because in colloquial language, we kind of keep on doing this switch.
4328000	4337000	We cannot. So the point I'm trying to make is that you can't and this is not the known.
4337000	4342000	So this is you can call it original research or only the original thesis or something like that.
4342000	4348000	This is not science does not approve of this yet.
4348000	4350000	This is not peer reviewed.
4351000	4364000	But I'm positing this is that you can't say which one is the direction of entropy by being inside of a system unless.
4364000	4374000	So for the designer, the entropy would always seem to go towards the end state that is more organized.
4374000	4384000	But for the players inside the system, it will always seem to go towards a more disorganized, even if the events are exactly the same.
4384000	4388000	Well, you can prove the statement with simple linear algebra.
4388000	4399000	I mean, I'm just saying that this is one of those very axiomatic statements because you need to be able to let's see, even if it's a matrix,
4399000	4409000	you need to be able to write the matrix in a way that you have at least one more dimension for you to compute the values of that dimension.
4409000	4422000	So you cannot by any chance know what is going to come out of a system unless you have access to a higher dimensionality from which to observe and compute the current dimensionality,
4422000	4429000	which also makes the capability of dimensionality increase and computing as unidirectional.
4429000	4435000	You can only observe higher from higher dimension or lower dimension cannot do the other way around.
4435000	4441000	So these are in the same sense, the established laws in physics, which again apply right here.
4441000	4450000	Yeah, this is one of the topics I just reminded me that we are probably looking back in that we need a higher dimensional to in order to comprehend the lower dimension.
4450000	4454000	This is the deja vu point. OK, so that part we understand now.
4454000	4459000	So with that framework in mind, think about the person.
4459000	4465000	If I'm a sculptor, for me, it's a block of stone.
4465000	4468000	I am chipping the stone away.
4468000	4471000	That is not the statue.
4471000	4478000	And what remains is the statue and a lot of broken stone chips everywhere else.
4478000	4486000	If you are somebody who doesn't, it's basically a fish that doesn't understand the concept of statue.
4486000	4495000	Looking at this entire event, sees that there was this big stone and now there's a lot of chips and one big chip.
4495000	4499000	This is how entropy, this is the direction of the entropy.
4499000	4505000	It is basically disintegrating. It is for breaking down. It is like basically flattening everything.
4505000	4511000	That is where it is seen. It doesn't see the intent was to make a statue.
4511000	4513000	Is it that statue?
4513000	4520000	If that is the case, that stone that is crumbling around, that is basically a byproduct.
4520000	4527000	Either you dust it away or you basically move on from there, take the statue with you.
4527000	4530000	You don't care about that part.
4530000	4533000	If you are the designer, it came to life.
4533000	4537000	You actually reduced entropy in a sense.
4537000	4542000	End of the day your end result was supposed to be the statue and now that is.
4542000	4551000	Whereas what started with this journey with the stone started with a lot of silica dust.
4551000	4557000	Eventually probably formed under some ocean basement millions of years back.
4557000	4560000	And then gradually got pushed out.
4560000	4564000	So if you think of that whole thing as a time lapse, what happened?
4564000	4570000	A lot of random particles came together, formed something and then became a statue.
4570000	4573000	And a couple of them stayed there.
4573000	4579000	Does it not look like a completely opposite of what we say that things cannot happen?
4579000	4581000	Entropy doesn't work that way.
4581000	4586000	Things don't come together in a shape. They just fall out of that shape.
4586000	4590000	So you can completely show that that is actually possible.
4590000	4592000	That's something that you can do.
4592000	4602000	Now that is only the case when the creator or designer, somebody with an intent is enforcing that.
4602000	4607000	That's only the time when seems to be entropy is actually going backwards.
4607000	4614000	But for the players, for the NPCs, it will always seem to go to a higher entropy state.
4614000	4619000	Even though the events are exactly the same.
4619000	4624000	Yep. So I mean, entropy is like the ultimate Borg.
4624000	4628000	The intentions are irrelevant. You will be assimilated.
4628000	4636000	Yeah. So the reason for me to bring this one out is kind of to put a pin on that entire discussion about.
4636000	4651000	So we probably are not done with the discussion, but probably still to put a pin on what is worth salvaging or like storing or basically collecting or documenting and keeping for a long term storage.
4651000	4658000	There's a lot of it is basically intent towards something.
4658000	4669000	And the ability. So then basically to touch along with that is a tamper proof history.
4669000	4678000	As a way of ensuring lesser degradation of the knowledge over time.
4678000	4689000	If you and then again, tamper proof history will also, of course, be it will only be from a certain point in time forwards till you have higher dimensionality.
4689000	4698000	Right. But just to wrap up. So the tamper proof history is important in the sense that you're not storing all of the information.
4698000	4701000	The tamper proof like it's basically zero knowledge proofs.
4701000	4710000	It's smart contracts equivalent of things that you are storing, not just the maxims, not just the learnings or the archives or the intent.
4710000	4726000	In this case, if you want to guarantee that it won't be tampered with so high guarantee versus a loose guarantee, the high guarantee should also have mechanism for you to reproduce that final state like a theorem.
4726000	4735000	So to say, then what you archive, what is worth archiving, primary answer would be the intent.
4735000	4742000	Because it's only when you apply intent frame on frame on frame, intent action, intent action, intent action.
4742000	4754000	If you believe in that homogeneous causality, that is, if you want to implement a homogeneous causality, then let's just say in kit terms.
4754000	4768000	Continuous. Yeah, a continuous, but unidirectional causality of equal intervals like intent precedes an action.
4768000	4778000	So the in this case is simply going to be a high guarantee.
4778000	4788000	If you are storing only the intent, sorry, low guarantee for storing only the intent, a high guarantee if you're storing the intent along with the replay mechanism.
4788000	4796000	But just because when we say low loose guarantee does not mean falsification.
4796000	4806000	Lose guarantee is simply saying that you will have to take this as face value because you don't have any way to reproduce this to know for yourself.
4806000	4809000	But it has not been changed.
4809000	4813000	OK, that is a good as in a baseline.
4813000	4820000	I have two things to add there like nothing to like it's not doesn't exclude from what you already said.
4820000	4826000	I want to add that perspective, adding more perspective to existing data.
4826000	4831000	So basically multiple accounts to the same story to avoid that.
4831000	4836000	What is the term that you used for what history?
4836000	4838000	For a lot of the things.
4838000	4842000	Temper proof revisionist revisionist.
4842000	4862000	So to avoid one single narrative to through some certain filter instead of that coming to become like being treated as a history, let all the different filters play their role and record all of those.
4862000	4868000	Don't be the judge and judge decide which one is more relevant, which one is actually correct.
4868000	4878000	So think of it in this way, then your view of history is just a query on that database on the database of history or whatever part of history you have access to.
4878000	4883000	Yes, because there can be many databases which can choose to communicate or not.
4883000	4888000	So at any point you only have a limited view of something.
4888000	4891000	I mean, the best way I can explain it is by Dota.
4891000	4894000	Your map has begun to explode only certain events.
4894000	4897000	Don't be have the audacity to ask for what is there in the dark.
4897000	4898000	Go find it.
4898000	4900000	Yeah, yeah, exactly.
4900000	4912000	So if that is the case, if then, I mean, a lot of the solved problems we are just basically philosophizing game design to a point that why are games designed the way they are designed?
4912000	4914000	There's a very good reason for me to do that.
4914000	4916000	And I will come to that after some point.
4916000	4917000	But yes, you are correct.
4917000	4918000	I know, I know.
4918000	4931000	I'm just again connecting in let's say for the sake of viewers or for us as the future viewer that a lot of what is happening has very strong analogies to the concerns faced by game design and have been answered in different ways.
4931000	4935000	So basically the philosophy for our times.
4935000	4942000	One is possibly the information like the impact of AI, which are again very large scale endeavors.
4942000	4960000	But if you really want to geek out on something more tangible, try to philosophize software or like systems design tradeoffs, the architecture, why something is built, how it is built and why, why, why are games entirely different?
4961000	4973000	Which are also applications themselves of application development such that we distinguish in our software industry as a game developer and an application developer, a JavaScript developer and a game developer.
4973000	4976000	What's going on there?
4976000	4989000	What and what I'm saying is that the things that we are touching has foundations in some of those things for you, extensive experience with Dota for me, certain other things.
4989000	4996000	But you see that some of these also have answers to very complex certain complexities of our daily life.
4996000	5002000	And I'll just at this point just leave two nuggets, which may be pick up at a later point.
5002000	5007000	One of them is the entity component system architecture.
5007000	5010000	What it does, why it does.
5010000	5013000	Can you write it down in the chats?
5013000	5015000	Yeah.
5015000	5017000	Come back to it, essentially.
5017000	5020000	I don't want to.
5020000	5027000	Sorry.
5027000	5030000	Oh, okay.
5030000	5032000	I couldn't hear it properly.
5032000	5035000	Yes, I figured.
5035000	5039000	What we don't mention here is, of course, why it is used.
5039000	5049000	But ECS is one of those architectural patterns that I find very close to my heart.
5049000	5060000	Because it tries to, I mean, it is a sort of, in that sense, superset or an application of functional programming concepts in the way that it is encapsulating the concept of components.
5060000	5069000	But it's kind of a worldview, which is very similar to how I kind of think of the word, like as something that is a state transformer.
5069000	5075000	A massive state transformer with very intricate rules all the way down to the smallest levels.
5075000	5079000	But then entities are independent.
5079000	5086000	But I would just like to use the same things that we're doing to analyze entity component system as a case study.
5086000	5092000	And see what are the trade-offs that it makes, which, again, you cannot get with an object-oriented thing.
5092000	5095000	We can, of course, compare, particularly with a waste of time.
5095000	5113000	And the other aspect that kind of ties this through a lot of this is the edge that, again, like I said in the beginning, why does our existing current AI system, so let's say generative AI or whichever form,
5113000	5126000	I'm just saying status quo and whatever research is in progress at this point, the totality of that, that they seem to be facing certain questions that have been answered again and again.
5126000	5131000	And there are some very smart people who are also thinking along those lines.
5131000	5151000	And then I want to move the discussion beyond just, oh, like, let's say ethics of AI in a generic sense, or should we do this, should we do that, to what are the things that we could not do earlier and hence had not considered at all.
5151000	5155000	And like, and we are able to do that.
5155000	5157000	So I kind of lost the thread there.
5157000	5177000	But yeah, I always think that, yes, when this ties together with the deeply political aspects of our thought and are probably how some of our technology choices are being your mind.
5177000	5183000	Tends to be and again from theoretical perspective that tends to be anarchist in nature.
5183000	5190000	And again, not the bomb throwing anarchist, but the theoretical anarchist principle.
5190000	5192000	So I intend to delve deeper into this.
5192000	5196000	I've been reading up a bit to connect the dots here.
5196000	5202000	And at the same time, it exhibits very strong nihilistic tendencies.
5202000	5204000	And why does it do that?
5204000	5212000	Because a lot of the questions we are asking around archival have also come from the fact that we have lost enough information in our life.
5212000	5215000	It's not coming from an ideological stance alone.
5215000	5224000	It's an ideological stance informed by the losses we have already experienced, which we have not been able to recover, some way or the other.
5224000	5227000	So there's like personal skin in the game.
5227000	5233000	But a lot of these concepts would then look at that one key perspective.
5233000	5240000	So you mentioned some of the things and thanks for like kind of reeling the whole thing together.
5240000	5245000	I know that there are lots of topics that we could go through today itself.
5245000	5252000	But I think it's better that we take the small bite chew over and then come keep coming back and do more of that.
5253000	5259000	Sustaining that high is probably more important than like getting in, being too excited and then burning out.
